id,name,model_id:id,group_id:id,perm_read,perm_write,perm_create,perm_unlink
access_estate_property,access_estate_property,model_estate_property,base.group_user,1,1,1,0
access_estate_property_type,Access to Real Estate Property Type,model_estate_property_type,base.group_user,1,1,1,0
access_estate_property_tag,Access to Real Estate Property Tag,model_estate_property_tag,base.group_user,1,1,1,0
access_estate_property_offer,Access to Real Estate Property Offers,model_estate_property_offers,base.group_user,1,1,1,0
access_estate_property_offers_accept,Access to Offer accept,model_estate_property_offers_accept_popup,base.group_user,1,1,1,0
